{"stage": "spec-compliance", "verdict": "PASS", "spec_citations": [],
 "summary": "AC-1..AC-7 all met. 35 hooks.json uv-run entry points (12 plugins + shared) carry a PEP 723 header with requires-python >=3.11 and deps covering --with; --no-project retained; the ledger is derived from hooks.json; the poisoned-CWD run covers plain and --no-project; the headerless negative control skips visibly; the #814 test keeps its assertions and its negative control now runs a headerless probe; vendored copies are consistent with the template; docs cover both layers, what was verified and what is not covered. No out-of-scope changes."}
