{"stage": "spec-compliance", "verdict": "PASS", "spec_citations": [], "summary": "The diff matches the spec. All 5 acceptance criteria are met and nothing was added beyond what the spec asks for. AC-1 through AC-5 verified against the actual hooks.json files, the two new test files, and docs/hooks-and-pipeline.md. The writing-plugin.md change and the shipwright-build test fix are both traced to findings the spec itself records (Internal Plan Review finding 9, finding 4). Nothing out-of-scope was built. Minor nit outside spec scope: _find_real_uv_run_command's return-type annotation said -> str but returned a tuple; fixed to -> tuple[str, str]."}
