{
  "stage": "spec-compliance",
  "verdict": "PASS",
  "spec_citations": [],
  "summary": "R2 implements every item in the spec's 'Files to create/modify', 'Work breakdown' and both 'Scope boundary' prohibitions, faithfully and without scope creep. Two Test-strategy lines are satisfied by close proxies rather than literally ('created concurrently'; 'non-fatal to the runner's own build'); neither is a behavioural divergence, so they are handed to Stage 2 as notes, not a block. Code-reviewer may proceed."
}
